{
  "$schema": "https://json-schema.org/draft/2020-12/schema",
  "$id": "https://example.invalid/roco-handbook/remote_catalog_payload_v1.schema.json",
  "title": "Remote catalog signed payload V1",
  "type": "object",
  "additionalProperties": false,
  "required": [
    "protocol_version",
    "minimum_protocol_version",
    "dataset_id",
    "catalog_schema_version",
    "data_version",
    "release_sequence",
    "minimum_app_version",
    "published_at_utc",
    "snapshot_id",
    "coverage",
    "package"
  ],
  "properties": {
    "protocol_version": {"const": 1},
    "minimum_protocol_version": {"const": 1},
    "dataset_id": {"const": "roco-world-zh-cn"},
    "catalog_schema_version": {"type": "integer", "minimum": 1},
    "data_version": {"type": "integer", "minimum": 1},
    "release_sequence": {"type": "integer", "minimum": 1},
    "minimum_app_version": {"type": "string", "pattern": "^(0|[1-9][0-9]*)\\.(0|[1-9][0-9]*)\\.(0|[1-9][0-9]*)$"},
    "published_at_utc": {"type": "string", "pattern": "^[0-9]{4}-[0-9]{2}-[0-9]{2}T[0-9]{2}:[0-9]{2}:[0-9]{2}Z$"},
    "snapshot_id": {"type": "string", "pattern": "^snapshot-[0-9a-z-]{8,80}$"},
    "coverage": {
      "type": "object",
      "additionalProperties": false,
      "required": [
        "pets",
        "skills",
        "evolutions",
        "topic_rewards",
        "skill_stone_topics",
        "description_note_definitions"
      ],
      "properties": {
        "pets": {"type": "boolean"},
        "skills": {"type": "boolean"},
        "evolutions": {"type": "boolean"},
        "topic_rewards": {"type": "boolean"},
        "skill_stone_topics": {"type": "boolean"},
        "description_note_definitions": {"type": "boolean"}
      }
    },
    "package": {
      "type": "object",
      "additionalProperties": false,
      "required": [
        "kind",
        "archive_format",
        "url",
        "archive_bytes",
        "archive_sha256"
      ],
      "properties": {
        "kind": {"const": "complete_catalog"},
        "archive_format": {"const": "zip"},
        "url": {"type": "string", "format": "uri"},
        "archive_bytes": {"type": "integer", "minimum": 1},
        "archive_sha256": {"type": "string", "pattern": "^[0-9a-f]{64}$"}
      }
    }
  }
}
