{"catalog_schema_version":1,"coverage":{"description_note_definitions":false,"evolutions":true,"pets":true,"skill_stone_topics":false,"skills":true,"topic_rewards":false},"data_version":2,"dataset_id":"roco-world-zh-cn","minimum_app_version":"1.0.0","minimum_protocol_version":1,"package":{"archive_bytes":51,"archive_format":"zip","archive_sha256":"1f4d7f70eb6a843ac9d246744c155361de1658cddf7864c213caed1d83033a11","kind":"complete_catalog","url":"https://updates.example.test/full/catalog-v2.zip"},"protocol_version":1,"published_at_utc":"2026-09-09T13:40:00Z","release_sequence":2,"snapshot_id":"snapshot-phase7-fixture-v2"}
